<?xml version="1.0"?>
<?xml-stylesheet type="text/xsl" href="../style.xsl"?>

<set name="coordination set 1" level="purple"
 xmlns:xsi="http://www.w3.org/2001/XMLSchema-instance"
 xsi:noNamespaceSchemaLocation="schema.xsd">
  <steps>
    <step>
      Step back into a left neutral bow while executing a left vertical
      outward block.
    </step>
    <step>
      Extend your left outward block forward into a head level left
      straight punch.
    </step>
    <step>
      Pivot into a left forward bow while executing a right reverse punch
      to the solar plexus.
    </step>
    <step>
      Execute a right snapping front kick with left punch.
    </step>
    <step>
      Land back into a left forward bow while executing a right reverse punch.
    </step>

    <step>
      Step forward and through with your right foot into a right neutral bow
      while executing a right outward vertical block.
    </step>
    <step>
      Extend your right outward block forward into a right straight punch.
    </step>
    <step>
      Pivot into a right forward bow while executing a left reverse punch
      to the solar plexus.
    </step>
    <step>
      Execute a left snapping front kick with a right punch.
    </step>
    <step>
      Land back into a right forward bow while executing a left reverse punch.
    </step>

    <step>
      Step back to 3:00 into a left neutral bow while executing a left
      vertical outward block.
    </step>
    <step>
      Extend your left outward block forward into a left straight punch.
    </step>
    <step>
      Pivot into a left forward bow while executing a right reverse punch
      to the solar plexus.
    </step>
    <step>
      Execute a right snapping front kick with a left punch.
    </step>
    <step>
      Land back into a left forward bow while executing a right reverse punch.
    </step>

    <step>
      Step forward and through with your right foot into a right neutral
      bow while executing a right outward vertical block.
    </step>
    <step>
      Extend your right outward block forward into a right straight punch.
    </step>
    <step>
      Pivot into a right forward bow while executing a left reverse punch
      to the solar plexus.
    </step>
    <step>
      Execute a left snapping front kick with a right punch.
    </step>
    <step>
      Land back into a right forward bow while executing a left reverse punch.
    </step>

    <step>
      Step back to 12:00 into a left neutral bow while executing a left
      vertical outward block.
    </step>
    <step>
      Extend your left outward block forward into a head level straight punch.
    </step>
    <step>
      Pivot into a left forward bow while executing a right reverse punch
      to the solar plexus.
    </step>
    <step>
      Execute a right snapping front kick with a left punch.
    </step>
    <step>
      Land back into a left forward bow while executing a right reverse punch.
    </step>

    <step>
      Step forward and through with your right foot into a right neutral bow
      while executing a right outward vertical block.
    </step>
    <step>
      Extend your right outward block forward into a right straight punch.
    </step>
    <step>
      Pivot into a right forward bow while executing a left reverse punch
      to the solar plexus.
    </step>
    <step>
      Execute a left snapping front kick with a right punch.
    </step>
    <step>
      Land back into a right forward bow while executing a left reverse punch.
    </step>

    <step>
      Step back to 9:00 into a left neutral bow while executing a left
      vertical outward block.
    </step>
    <step>
      Extend your left outward block forward into a head level straight punch.
    </step>
    <step>
      Pivot into a left forward bow while executing a right reverse punch to
      the solar plexus.
    </step>
    <step>
      Execute a right snapping front kick with a left punch
    </step>
    <step>
      Land back into a left forward bow while executing a right reverse punch.
    </step>

    <step>
      Step forward and through with your right foot into a right neutral bow
      while executing a right outward vertical block.
    </step>
    <step>
      Extend your right outward block forward into a right straight punch.
    </step>
    <step>
      Pivot into a right forward bow while executing a left reverse punch to
      the solar plexus.
    </step>
    <step>
      Execute a left snapping front kick with a right punch.
    </step>
    <step>
      Land back into a right forward bow while executing a left reverse punch.
    </step>

    <step>
      Step back to 6:00 into a left neutral bow while executing a left vertical
      outward block.
    </step>
    <step>
      Extend your left outward block forward into a left straight punch.
    </step>
    <step>
      Pivot into a left forward bow while executing a right reverse punch to
      the solar plexus.
    </step>
    <step>
      Execute a right snapping front kick with a left punch.
    </step>
    <step>
      Land back into a left forward bow while executing a right reverse punch.
    </step>

    <step>
      Step forward and through with your right foot into a right neutral bow
      while executing a right outward vertical block.
    </step>
    <step>
      Extend your right outward block forward into a right straight punch.
    </step>
    <step>
      Pivot into a right forward bow while executing a left reverse punch to
      the solar plexus.
    </step>
    <step>
      Execute a left snapping front kick with a right punch.
    </step>
    <step>
      Land back into a right forward bow while executing a left reverse punch.
    </step>
    <step>
      Step back with your right foot into a meditating horse stance.
    </step>
  </steps>
</set>
