<?xml version="1.0"?>
<?xml-stylesheet type="text/xsl" href="../style.xsl"?>

<technique name="reversing mace" level="orange" category="punch"
 xmlns:xsi="http://www.w3.org/2001/XMLSchema-instance"
 xsi:noNamespaceSchemaLocation="schema.xsd">
  <attack>left step-through straight punch</attack>
  <stances>
    <attacker>right neutral bow</attacker>
    <defender>natural</defender>
  </stances>
  <steps>
    <step>
      <footManeuver side="right">step</footManeuver> toward 12:00 into a
      <stance side="right">reverse bow</stance> as you execute a
      <parry side="right">inward</parry> to the outside of your opponent's
      left arm.
    </step>
    <step>
      <footManeuver>pivot</footManeuver> into a
      <stance side="right">neutral bow</stance> as you execute a
      <parry side="left">outward</parry> to the outside of your opponent's
      left arm. Simultaneously execute a
      <strike side="right">back knuckle</strike> to your opponent's left ribs.
    </step>
    <step>
      Draw your left foot toward your right into a
      <stance side="right">cat</stance> stance.
    </step>
    <step>
      Execute a <kick side="right">downward looping roundhouse</kick> to the
      top of your opponent's left calf.
    </step>
  </steps>
</technique>
