<?xml version="1.0"?>

<!-- this file is autogenerated! -->

<techniques>
	<technique category="hugs and holds" href="thrusting-prongs.xml" level="orange" name="thrusting prongs" xmlns:xsi="http://www.w3.org/2001/XMLSchema-instance" xsi:noNamespaceSchemaLocation="schema.xsd"/>
	<technique category="chokes-and-locks" href="captured-leaves.xml" level="purple" name="captured leaves" xmlns:xsi="http://www.w3.org/2001/XMLSchema-instance" xsi:noNamespaceSchemaLocation="schema.xsd"/>
	<technique category="grabs-and-tackles" href="delayed-sword.xml" level="yellow" name="delayed sword" xmlns:xsi="http://www.w3.org/2001/XMLSchema-instance" xsi:noNamespaceSchemaLocation="schema.xsd"/>
	<technique category="punch" href="sword-of-destruction.xml" level="yellow" name="sword of destruction" xmlns:xsi="http://www.w3.org/2001/XMLSchema-instance" xsi:noNamespaceSchemaLocation="schema.xsd"/>
	<technique category="hugs-and-holds" href="locked-wing.xml" level="green" name="locked wing" xmlns:xsi="http://www.w3.org/2001/XMLSchema-instance" xsi:noNamespaceSchemaLocation="schema.xsd"/>
	<technique category="kick" href="intellectual-departure.xml" name="intellectual departure" xmlns:xsi="http://www.w3.org/2001/XMLSchema-instance" xsi:noNamespaceSchemaLocation="schema.xsd"/>
	<technique category="grabs-and-tackles" href="broken-ram.xml" level="first-brown" name="broken ram" xmlns:xsi="http://www.w3.org/2001/XMLSchema-instance" xsi:noNamespaceSchemaLocation="schema.xsd"/>
	<technique category="punch" href="shield-and-mace.xml" level="first-brown" name="shield and mace" xmlns:xsi="http://www.w3.org/2001/XMLSchema-instance" xsi:noNamespaceSchemaLocation="schema.xsd"/>
	<technique category="grab" href="clutching-feathers.xml" level="orange" name="clutching feathers" xmlns:xsi="http://www.w3.org/2001/XMLSchema-instance" xsi:noNamespaceSchemaLocation="schema.xsd"/>
	<technique category="punch" href="reversing-mace.xml" level="orange" name="reversing mace" xmlns:xsi="http://www.w3.org/2001/XMLSchema-instance" xsi:noNamespaceSchemaLocation="schema.xsd"/>
	<technique category="chokes-and-locks" href="passing-the-horizon.xml" name="passing the horizon" xmlns:xsi="http://www.w3.org/2001/XMLSchema-instance" xsi:noNamespaceSchemaLocation="schema.xsd"/>
	<technique category="grabs-and-tackles" href="lone-kimono.xml" level="orange" name="lone kimono" xmlns:xsi="http://www.w3.org/2001/XMLSchema-instance" xsi:noNamespaceSchemaLocation="schema.xsd"/>
	<technique category="grabs-and-tackles" href="crossing-talon.xml" level="orange" name="crossing talon" xmlns:xsi="http://www.w3.org/2001/XMLSchema-instance" xsi:noNamespaceSchemaLocation="schema.xsd"/>
	<technique category="push" href="glancing-salute.xml" level="orange" name="glancing salute" xmlns:xsi="http://www.w3.org/2001/XMLSchema-instance" xsi:noNamespaceSchemaLocation="schema.xsd"/>
	<technique category="weapons" href="evading-the-storm.xml" level="purple" name="evading the storm" xmlns:xsi="http://www.w3.org/2001/XMLSchema-instance" xsi:noNamespaceSchemaLocation="schema.xsd"/>
	<technique category="push" href="thrusting-wedge.xml" level="green" name="thrusting wedge" xmlns:xsi="http://www.w3.org/2001/XMLSchema-instance" xsi:noNamespaceSchemaLocation="schema.xsd"/>
	<technique category="push" href="repeating-mace.xml" level="orange" name="repeating mace" xmlns:xsi="http://www.w3.org/2001/XMLSchema-instance" xsi:noNamespaceSchemaLocation="schema.xsd"/>
	<technique category="grabs-and-tackles" href="sword-and-hammer.xml" name="sword and hammer" xmlns:xsi="http://www.w3.org/2001/XMLSchema-instance" xsi:noNamespaceSchemaLocation="schema.xsd"/>
	<technique category="punch" href="raining-claw.xml" level="purple" name="raining claw" xmlns:xsi="http://www.w3.org/2001/XMLSchema-instance" xsi:noNamespaceSchemaLocation="schema.xsd"/>
	<technique category="" href="template.xml" level="" name="" xmlns:xsi="http://www.w3.org/2001/XMLSchema-instance" xsi:noNamespaceSchemaLocation="schema.xsd"/>
	<technique category="kick" href="buckling-branch.xml" level="orange" name="buckling branch" xmlns:xsi="http://www.w3.org/2001/XMLSchema-instance" xsi:noNamespaceSchemaLocation="schema.xsd"/>
	<technique category="kick" href="swinging-pendulum.xml" level="purple" name="swinging pendulum" xmlns:xsi="http://www.w3.org/2001/XMLSchema-instance" xsi:noNamespaceSchemaLocation="schema.xsd"/>
	<technique category="hugs-and-holds" href="scraping-hoof.xml" level="orange" name="scraping hoof" xmlns:xsi="http://www.w3.org/2001/XMLSchema-instance" xsi:noNamespaceSchemaLocation="schema.xsd"/>
	<technique category="chokes-and-locks" href="grasp-of-death.xml" level="yellow" name="grasp of death" xmlns:xsi="http://www.w3.org/2001/XMLSchema-instance" xsi:noNamespaceSchemaLocation="schema.xsd"/>
	<technique category="push" href="alternating-maces.xml" name="alternating maces" xmlns:xsi="http://www.w3.org/2001/XMLSchema-instance" xsi:noNamespaceSchemaLocation="schema.xsd"/>
</techniques>
